{
  "$schema": "https://opto-sync.dev/schema/opto-sync-sdk-api.schema.json",
  "contract": "opto-sync.sdk-api.v1",
  "contractVersion": "1.0.0",
  "envelopeSchema": {
    "path": "schema/opto-sync-envelope.schema.json",
    "id": "https://opto-sync.dev/schema/opto-sync-envelope.schema.json"
  },
  "valuesSchema": {
    "path": "schema/opto-sync-sdk-values.v1.schema.json",
    "id": "https://opto-sync.dev/schema/opto-sync-sdk-values.v1.schema.json"
  },
  "mergeOptionsSchema": {
    "repository": "opto-sync/syncer.rs",
    "commit": "8ef3d4bb63738a90b1e3958500578aebb89ee8cc",
    "path": "schema/merge-options.schema.json",
    "id": "https://opto-sync.dev/schema/merge-options.schema.json",
    "sha256": "d5bd069eefc24293e3f8d8e666bdbd1d2461b59853f73c0cea7bb7c0424d7bd8",
    "status": "candidate",
    "blockers": ["upstream-main", "cross-runtime-option-parity"]
  },
  "dependencies": {
    "sharedInterfaces": {
      "coordinate": "ores-otel/ores-interfaces",
      "version": "^0.1.0",
      "status": "pending-release",
      "integration": "injected"
    },
    "structuredLogging": {
      "coordinate": "oresoftware/next-loggers",
      "version": "^0.1.0",
      "status": "pending-release",
      "integration": "injected"
    }
  },
  "telemetry": {
    "mode": "injected",
    "namespace": "opto.sync",
    "payloadPolicy": "metadata_only",
    "sinkFailurePolicy": "ignore",
    "eventSchema": {
      "path": "schema/opto-sync-telemetry.schema.json",
      "id": "https://opto-sync.dev/schema/opto-sync-telemetry.v1.schema.json"
    }
  },
  "operations": [
    {
      "id": "queueUpsert",
      "category": "queue",
      "conformance": "candidate",
      "semantics": "Durably queue one object upsert under a table and record identity before reporting success.",
      "normalized": {
        "kind": "call",
        "requestSchemaRef": "https://opto-sync.dev/schema/opto-sync-sdk-values.v1.schema.json#/$defs/QueueUpsertRequest",
        "resultSchemaRef": "https://opto-sync.dev/schema/opto-sync-sdk-values.v1.schema.json#/$defs/MutationId"
      },
      "differences": [
        { "code": "result-identity", "dimension": "result", "languages": ["dart", "typescript"], "detail": "Returns a local database row id instead of the protocol mutation id." },
        { "code": "durability-layer", "dimension": "effect", "languages": ["rust"], "detail": "The bound ProtocolQueue method changes memory only instead of committing durable state." },
        { "code": "target-validation", "dimension": "validation", "languages": ["dart", "typescript"], "detail": "The bound database methods do not yet enforce the Rust scope and record identifier bounds." }
      ],
      "bindings": {
        "rust": { "source": "clients/rust/src/protocol.rs", "owner": "ProtocolQueue", "symbol": "queue_upsert", "kind": "method", "async": false, "declaration": "pub fn queue_upsert(" },
        "dart": { "source": "clients/dart/lib/opto_sync_client.dart", "owner": "OptoSyncClient", "symbol": "queueMutation", "kind": "method", "async": true, "declaration": "Future<int> queueMutation(" },
        "typescript": { "source": "clients/ts/src/client.ts", "owner": "OptoSyncClient", "symbol": "queueMutation", "kind": "method", "async": true, "declaration": "async queueMutation(" }
      }
    },
    {
      "id": "queueDelete",
      "category": "queue",
      "conformance": "candidate",
      "semantics": "Durably queue an explicit tombstone; absence or a null payload is never inferred as deletion.",
      "normalized": {
        "kind": "call",
        "requestSchemaRef": "https://opto-sync.dev/schema/opto-sync-sdk-values.v1.schema.json#/$defs/QueueDeleteRequest",
        "resultSchemaRef": "https://opto-sync.dev/schema/opto-sync-sdk-values.v1.schema.json#/$defs/MutationId"
      },
      "differences": [
        { "code": "result-identity", "dimension": "result", "languages": ["dart", "typescript"], "detail": "Returns a local database row id instead of the protocol mutation id." },
        { "code": "durability-layer", "dimension": "effect", "languages": ["rust"], "detail": "The bound ProtocolQueue method changes memory only instead of committing durable state." },
        { "code": "target-validation", "dimension": "validation", "languages": ["dart", "typescript"], "detail": "The bound database methods do not yet enforce the Rust scope and record identifier bounds." }
      ],
      "bindings": {
        "rust": { "source": "clients/rust/src/protocol.rs", "owner": "ProtocolQueue", "symbol": "queue_delete", "kind": "method", "async": false, "declaration": "pub fn queue_delete(" },
        "dart": { "source": "clients/dart/lib/opto_sync_client.dart", "owner": "OptoSyncClient", "symbol": "queueDelete", "kind": "method", "async": true, "declaration": "Future<int> queueDelete(" },
        "typescript": { "source": "clients/ts/src/client.ts", "owner": "OptoSyncClient", "symbol": "queueDelete", "kind": "method", "async": true, "declaration": "async queueDelete(" }
      }
    },
    {
      "id": "pendingMutations",
      "category": "queue",
      "conformance": "candidate",
      "semantics": "Read pending mutations in stable insertion order without changing durable queue state.",
      "normalized": {
        "kind": "call",
        "requestSchemaRef": "https://opto-sync.dev/schema/opto-sync-sdk-values.v1.schema.json#/$defs/PendingMutationsRequest",
        "resultSchemaRef": "https://opto-sync.dev/schema/opto-sync-sdk-values.v1.schema.json#/$defs/PendingMutationsResult"
      },
      "differences": [
        { "code": "query-shape", "dimension": "parameters", "languages": ["rust", "dart", "typescript"], "detail": "Rust is unbounded, Dart exposes a limit, and TypeScript exposes a table filter." },
        { "code": "storage-row-result", "dimension": "result", "languages": ["dart", "typescript"], "detail": "Database row results contain platform-local fields instead of only normalized protocol mutations." }
      ],
      "bindings": {
        "rust": { "source": "clients/rust/src/protocol.rs", "owner": "ProtocolQueue", "symbol": "pending", "kind": "method", "async": false, "declaration": "pub fn pending(&self)" },
        "dart": { "source": "clients/dart/lib/opto_sync_client.dart", "owner": "OptoSyncClient", "symbol": "pendingMutations", "kind": "method", "async": true, "declaration": "Future<List<Mutation>> pendingMutations(" },
        "typescript": { "source": "clients/ts/src/client.ts", "owner": "OptoSyncClient", "symbol": "pendingMutations", "kind": "method", "async": true, "declaration": "async pendingMutations(" }
      }
    },
    {
      "id": "buildPushRequest",
      "category": "protocol",
      "conformance": "candidate",
      "semantics": "Build one immutable protocol-v1 push request from the oldest contiguous pending mutations.",
      "normalized": {
        "kind": "call",
        "requestSchemaRef": "https://opto-sync.dev/schema/opto-sync-sdk-values.v1.schema.json#/$defs/BuildPushRequestRequest",
        "resultSchemaRef": "https://opto-sync.dev/schema/opto-sync-sdk-values.v1.schema.json#/$defs/PushRequest"
      },
      "differences": [
        { "code": "limit-surface", "dimension": "parameters", "languages": ["rust", "dart", "typescript"], "detail": "The limit is required, named with a default, or part of a legacy overload depending on runtime." },
        { "code": "queue-validity", "dimension": "validation", "languages": ["dart", "typescript"], "detail": "The database queues can contain target identifiers the Rust queue rejects before request construction." }
      ],
      "bindings": {
        "rust": { "source": "clients/rust/src/protocol.rs", "owner": "ProtocolQueue", "symbol": "push_request", "kind": "method", "async": false, "declaration": "pub fn push_request(" },
        "dart": { "source": "clients/dart/lib/opto_sync_client.dart", "owner": "OptoSyncClient", "symbol": "protocolPushRequest", "kind": "method", "async": true, "declaration": "Future<Map<String, dynamic>> protocolPushRequest(" },
        "typescript": { "source": "clients/ts/src/client.ts", "owner": "OptoSyncClient", "symbol": "protocolPushRequest", "kind": "method", "async": true, "declaration": "async protocolPushRequest(" }
      }
    },
    {
      "id": "acknowledgePush",
      "category": "protocol",
      "conformance": "candidate",
      "semantics": "Validate that a response names the exact sent batch before confirming any local mutation.",
      "normalized": {
        "kind": "call",
        "requestSchemaRef": "https://opto-sync.dev/schema/opto-sync-sdk-values.v1.schema.json#/$defs/AcknowledgePushRequest",
        "resultSchemaRef": "https://opto-sync.dev/schema/opto-sync-sdk-values.v1.schema.json#/$defs/Count"
      },
      "differences": [
        { "code": "durability-layer", "dimension": "effect", "languages": ["rust"], "detail": "The bound Rust queue transition remains in memory while Dart and TypeScript commit database state." }
      ],
      "bindings": {
        "rust": { "source": "clients/rust/src/protocol.rs", "owner": "ProtocolQueue", "symbol": "acknowledge", "kind": "method", "async": false, "declaration": "pub fn acknowledge(" },
        "dart": { "source": "clients/dart/lib/opto_sync_client.dart", "owner": "OptoSyncClient", "symbol": "acknowledgePush", "kind": "method", "async": true, "declaration": "Future<int> acknowledgePush(" },
        "typescript": { "source": "clients/ts/src/client.ts", "owner": "OptoSyncClient", "symbol": "acknowledgePush", "kind": "method", "async": true, "declaration": "async acknowledgePush(" }
      }
    },
    {
      "id": "pullCheckpoint",
      "category": "protocol",
      "conformance": "candidate",
      "semantics": "Return the last durably applied commit-ordered pull checkpoint, using zero before the first pull.",
      "normalized": {
        "kind": "call",
        "requestSchemaRef": "https://opto-sync.dev/schema/opto-sync-sdk-values.v1.schema.json#/$defs/EmptyRequest",